<?xml version="1.0" encoding="UTF-8"?>
<xs:schema xmlns:xs="http://www.w3.org/2001/XMLSchema">

    <xs:element name="Dependencies">
        <xs:complexType>
            <xs:sequence>
                <xs:element ref="Skeleton" maxOccurs="unbounded" minOccurs="0"/>
                <xs:element ref="Defines" maxOccurs="unbounded" minOccurs="0"/>
                </xs:sequence>
        </xs:complexType>
    </xs:element>

    <xs:element name="Skeleton">
        <xs:complexType>
            <xs:sequence>
                <xs:element name="Name" type="xs:string" maxOccurs="1"  minOccurs="1" />
                <xs:element ref="Superclasses" maxOccurs="1" minOccurs="1" />
                <xs:element ref="Member" maxOccurs="unbounded" minOccurs="0" />
            </xs:sequence>
        </xs:complexType>
    </xs:element>

    <xs:element name="Member">
        <xs:complexType>
            <xs:sequence>
                <xs:element name="Name" type="xs:string" maxOccurs="1"  minOccurs="1" />
                <xs:element ref="Classes" maxOccurs="1" minOccurs="0" />
            </xs:sequence>
        </xs:complexType>
    </xs:element>


  <xs:element name="Class">
    <xs:complexType>
      <xs:sequence>
        <xs:element ref="Property" maxOccurs="unbounded"  minOccurs="0" />
      </xs:sequence>
      <xs:attribute name="Name" type="xs:string" use="required"/>
      <xs:attribute name="Requires" type="xs:string" use="optional"/>
    </xs:complexType>
  </xs:element>

  <xs:element name="Property">
    <xs:complexType>
       <xs:attribute name="Name" type="xs:string" use="required"/>
       <xs:attribute name="Type" type="xs:string" use="required"/>
       <xs:attribute name="Optional" type="xs:boolean" use="optional"/>
       <xs:attribute name="Description" type="xs:string" use="optional"/>
    </xs:complexType>
  </xs:element>

  <xs:element name="PropertyValue">
    <xs:complexType>
      <xs:attribute name="Name" type="xs:string" use="required"/>
      <xs:attribute name="Value" type="xs:string" use="required"/>
    </xs:complexType>
  </xs:element>


  <xs:element name="Defaults">
    <xs:complexType>
      <xs:sequence>
        <xs:element ref="PropertyValue" maxOccurs="unbounded"  minOccurs="0" />
      </xs:sequence>
      <xs:attribute name="Class" type="xs:string"/>
    </xs:complexType>
  </xs:element>

  <xs:element name="MemberRef">
    <xs:complexType>
      <xs:sequence>
        <xs:element ref="Defaults" maxOccurs="unbounded"  minOccurs="0" />
      </xs:sequence>
      <xs:attribute name="Name" type="xs:string" use="required"/>
      <xs:attribute name="optional" type="xs:boolean"/>
    </xs:complexType>
  </xs:element>

  <xs:element name="Superclass">
    <xs:complexType>
      <xs:sequence>
        <xs:element ref="MemberRef" maxOccurs="unbounded"  minOccurs="0" />
      </xs:sequence>
      <xs:attribute name="Name" type="xs:string" use="required"/>
      <xs:attribute name="Provides" type="xs:string" use="optional"/>
    </xs:complexType>
  </xs:element>


    <xs:element name="Classes">
        <xs:complexType>
            <xs:sequence>
                <xs:element ref="Class" maxOccurs="unbounded" minOccurs="1"  />
            </xs:sequence>
        </xs:complexType>
    </xs:element>

    <xs:element name="Superclasses">
        <xs:complexType>
            <xs:sequence>
                <xs:element ref="Superclass" maxOccurs="unbounded" minOccurs="1" />
            </xs:sequence>
        </xs:complexType>
    </xs:element>

    <xs:element name="Defines">
        <xs:complexType>
            <xs:sequence>
                <xs:element ref="Define" maxOccurs="unbounded" minOccurs="0" />
            </xs:sequence>
        </xs:complexType>
    </xs:element>

    <xs:element name="Define">
        <xs:complexType>
            <xs:sequence>
                <xs:element name="Name" type="xs:string" maxOccurs="1"  minOccurs="1" />
                <xs:element name="Description" type="xs:string" maxOccurs="1" minOccurs="1" />
            </xs:sequence>
        </xs:complexType>
    </xs:element>

</xs:schema>